{
  "schemaVersion": 1,
  "agentId": "explorer",
  "fields": {
    "description": "Read-only explorer for the Aidrian harness producer, its generated host projections, and its provider-free verification fixtures."
  },
  "slots": {
    "context_map_path": "docs/self-dogfood.md",
    "docs_glob": "docs/*.md",
    "symbol_project_kind": "JavaScript module",
    "project_bootstrap": "For producer work, read README.md, docs/providers.md, and docs/self-dogfood.md. Treat catalog/** and src/build/build.mjs as compiler authority. Do not claim provider execution from rendered bytes; provider-attended rows remain unverified until their recorded host command runs.",
    "project_invariant_bullets": "   - compiler projection stays independent of Git and bundle identity\n   - generated producer paths stay outside the distribution manifest\n   - provider-attended evidence is never inferred from static output",
    "project_edge_case_bullets": "   - missing, extra, or stale generated files\n   - unavailable required reviewers without fallback\n   - state leakage between disposable consumers",
    "handoff_path": "docs/self-dogfood.md",
    "project_repository_rules": "Repository rules (must respect):\n\n- Keep the producer projection compiler-only.\n- Use immutable bundle pins only in disposable consumer fixtures.\n- Keep Claude and Codex evidence separate.\n- Return the mandatory machine handoff fields `status`, `role`, `decision`, `evidence`, `deferred_refs`, `blockers`, and `next_owner`; a blocked result names the failing provider or invariant.",
    "project_technical_rules": "Use the existing buildCatalog, assemblePrivateDistribution, and managed-projection interfaces directly. Generated files are checked outputs, never independent sources.",
    "project_harness_name": "Aidrian"
  }
}
